{
  "schema_version": 1,
  "country_code": "ITA",
  "section": "geography",
  "revision": 2,
  "updated_at": "2026-10-27",
  "language": "fa",
  "title": "جغرافیا و طبیعت ایتالیا",
  "intro": "قلمرو ایتالیا شامل شبه‌جزیره‌ای بلند در مدیترانه، جزیره‌های بزرگ سیسیل و ساردینیا و چند جزیره کوچک است. در مرزهای بین‌المللی و همجواری دریایی باید تفاوت گذاشت.",
  "metrics": [],
  "topics": [
    {
      "id": "location-and-coasts",
      "title": "جایگاه و سواحل",
      "lead": "ایتالیا در جنوب اروپا قرار دارد و شبه‌جزیره آن میان دریای آدریاتیک در شرق و دریای تیرنی در غرب امتداد می‌یابد.",
      "parts": [
        [
          "مرز زمینی",
          "ایتالیا با فرانسه، سوئیس، اتریش و اسلوونی مرز زمینی دارد. دو دولت مستقل محصور در خاک ایتالیا، واتیکان و سان‌مارینو هستند؛ آن‌ها همسایه زمینی جداگانه به شمار می‌آیند."
        ],
        [
          "همجواری دریایی",
          "کرانه‌های ایتالیا به دریای لیگوریا، تیرنی، ایونی و آدریاتیک می‌رسد. دریای مدیترانه چارچوب پهنه‌ای منطقه است؛ «همجواری دریایی» به‌تنهایی ادعای مرز دریایی رسمی نیست."
        ],
        [
          "جزیره‌ها و شبه‌جزیره",
          "سیسیل و ساردینیا بزرگ‌ترین جزیره‌ها هستند. کالابریا و آپولیا در جنوب، پاشنه و پنجه نمادین چکمه شبه‌جزیره را می‌سازند. جزیره‌های کوچک‌تر در دریای تیرنی و اطراف سیسیل قرار دارند."
        ]
      ],
      "sources": [
        [
          "اتحادیه اروپا؛ پروفایل کشور ایتالیا",
          "https://european-union.europa.eu/principles-countries-history/country-profiles/italy_en"
        ],
        [
          "Istat؛ اطلاعات سرزمینی و نقشه‌نگاری، شامل واحدهای اداری",
          "https://www.istat.it/en/statistical-themes/environment-and-territory/territory-and-cartography/"
        ],
        [
          "Natural Earth؛ داده برداری عمومی و مقیاس نقشه",
          "https://www.naturalearthdata.com/about/terms-of-use/"
        ]
      ]
    },
    {
      "id": "relief-climate",
      "title": "ناهمواری، آب‌وهوا و مخاطرات",
      "lead": "رشته‌کوه آلپ در شمال و آپنین در امتداد شبه‌جزیره، اقلیم و دسترسی منطقه‌ای را شکل می‌دهند.",
      "parts": [
        [
          "کوه‌ها و آب‌ها",
          "مونته بیانکو/مون‌بلان در مرز فرانسه و ایتالیا از بلندترین قله‌های آلپ است؛ تعیین ارتفاع و انتساب دقیق قله‌های مرزی به روش اندازه‌گیری وابسته است. رود پو مهم‌ترین سامانه رودخانه‌ای شمال است و به دریای آدریاتیک می‌ریزد. دریاچه‌های گاردا، ماجوره و کومو در شمال قرار دارند."
        ],
        [
          "اقلیم‌های منطقه‌ای",
          "شمال داخلی و آلپی زمستان‌های سردتر دارد؛ دره پو از رطوبت و مه فصلی اثر می‌گیرد. نواحی ساحلی و جنوب معمولاً الگوی مدیترانه‌ای با تابستان گرم و کم‌بارش دارند، اما ارتفاع، عرض جغرافیایی و جهت دامنه‌ها تفاوت محلی مهمی ایجاد می‌کند."
        ],
        [
          "خطرهای طبیعی",
          "ایتالیا در پهنه فعال زمین‌ساختی قرار دارد؛ زمین‌لرزه، فوران آتشفشانی، رانش زمین، سیل و موج گرما مخاطرات شناخته‌شده‌اند. کوه آتنا در سیسیل و وزوو در کامپانیا آتشفشان‌های فعال/پایش‌شونده‌اند."
        ]
      ],
      "sources": [
        [
          "آژانس محیط زیست اروپا؛ نمایه محیط زیستی ایتالیا، ۲۰۲۵",
          "https://www.eea.europa.eu/en/europe-environment-2025/countries/italy"
        ],
        [
          "اتحادیه اروپا؛ پروفایل کشور ایتالیا",
          "https://european-union.europa.eu/principles-countries-history/country-profiles/italy_en"
        ],
        [
          "Natural Earth؛ داده برداری عمومی و مقیاس نقشه",
          "https://www.naturalearthdata.com/about/terms-of-use/"
        ]
      ]
    },
    {
      "id": "geography-seas-islands",
      "title": "دریاها، سواحل و جزایر",
      "lead": "شبه‌جزیره و جزایر بزرگ ایتالیا، دسترسی دریایی و تفاوت‌های محلی چشم‌انداز را شکل می‌دهند.",
      "parts": [
        [
          "دریاها",
          "دریای لیگوری، تیرنی، ایونی و آدریاتیک بخش‌هایی از مدیترانه‌اند که کرانه‌های شبه‌جزیره و جزیره‌ها را دربرمی‌گیرند؛ این همجواری دریایی با مرز زمینی یکی نیست."
        ],
        [
          "جزایر",
          "سیسیل و ساردینیا دو جزیره بزرگ‌اند؛ آئولی، اگادی، پونتین، توسکانی و لا مادالنا از مجمع‌الجزایرهای شناخته‌شده‌اند."
        ],
        [
          "اتصال و دسترسی",
          "جزیره‌ها به مسیرهای کشتی و پرواز وابسته‌اند. زمان‌بندی ferry و محدودیت دریا متغیر است و باید پیش از سفر از شرکت حمل‌ونقل بررسی شود."
        ]
      ],
      "sources": [
        [
          "اتحادیه اروپا؛ پروفایل ایتالیا",
          "https://european-union.europa.eu/principles-countries-history/country-profiles/italy_en"
        ],
        [
          "وبگاه رسمی گردشگری ایتالیا؛ Italia.it",
          "https://www.italia.it/en"
        ]
      ]
    },
    {
      "id": "geography-volcanoes-and-hazards",
      "title": "آتشفشان‌ها و مخاطرات طبیعی",
      "lead": "تنوع زمین‌شناختی ایتالیا هم جاذبه طبیعی پدید آورده و هم خطر زمین‌لرزه، آتشفشان، سیل و رانش زمین.",
      "parts": [
        [
          "آتشفشان",
          "اتنا، وزوو و استرومبولی از آتشفشان‌های مهم و پایش‌شده‌اند. هشدار، محدودیت دسترسی و مسیرهای امن به وضعیت روز وابسته است."
        ],
        [
          "زمین‌لرزه و رانش",
          "زلزله و رانش زمین در بخش‌هایی از آپنین و دیگر نواحی کوهستانی خطر جدی دارند؛ میزان خطر محلی است و از میانگین ملی قابل استنتاج نیست."
        ],
        [
          "مدیریت خطر",
          "سازمان حفاظت مدنی، شهرداری‌ها و نهادهای علمی هشدارها و نقشه‌های خطر را منتشر می‌کنند؛ در سفر یا حادثه، اطلاعیه رسمی همان روز ملاک است."
        ]
      ],
      "sources": [
        [
          "سازمان حفاظت مدنی ایتالیا",
          "https://www.protezionecivile.gov.it/en/"
        ],
        [
          "مؤسسه ملی ژئوفیزیک و آتشفشان‌شناسی ایتالیا",
          "https://www.ingv.it/en/"
        ]
      ]
    }
  ],
  "facts": [],
  "neighbors": [
    {
      "code": "FRA",
      "name": "فرانسه",
      "direction": "شمال‌غرب"
    },
    {
      "code": "CHE",
      "name": "سوئیس",
      "direction": "شمال"
    },
    {
      "code": "AUT",
      "name": "اتریش",
      "direction": "شمال‌شرق"
    },
    {
      "code": "SVN",
      "name": "اسلوونی",
      "direction": "شرق"
    },
    {
      "code": "SMR",
      "name": "سان‌مارینو",
      "direction": "داخل شبه‌جزیره"
    },
    {
      "code": "VAT",
      "name": "واتیکان",
      "direction": "داخل شهر رم"
    }
  ],
  "map_points": [
    {
      "id": "rome",
      "name": "رم",
      "longitude": 12.4964,
      "latitude": 41.9028,
      "topic": "location-and-coasts",
      "description": "پایتخت جمهوری ایتالیا؛ مختصات مرکز شهری تقریبی.",
      "source": "https://www.geonames.org/3169070/rome.html"
    },
    {
      "id": "mount-etna",
      "name": "کوه آتنا",
      "longitude": 15.0042,
      "latitude": 37.751,
      "topic": "relief-climate",
      "description": "آتشفشان فعال در سیسیل؛ نقطه تقریبی برای نمایش موضوعی.",
      "source": "https://www.ingv.it/en/"
    }
  ],
  "key_tables": [
    {
      "type": "table",
      "id": "physical-geography",
      "title": "ویژگی‌های جغرافیایی",
      "columns": [
        "شاخص",
        "مقدار یا توصیف",
        "تعریف/یادداشت"
      ],
      "rows": [
        [
          "مساحت قلمرو آماری",
          "۳۰۲٬۱۰۹٫۶ کیلومتر مربع",
          "مجموع مساحت ۷٬۹۰۴ شهرداری در ۳۱ دسامبر ۲۰۲۱؛ محاسبه GIS بر پایه مرزهای آماری Istat"
        ],
        [
          "بلندترین نقطه",
          "مونته بیانکو/مون‌بلان؛ قله مرزی آلپ",
          "ارتفاع اندازه‌گیری‌شده با روش و مرزبندی گزارش منبع خوانده شود"
        ],
        [
          "رودهای شاخص",
          "پو، آدیجه، تیبر، آرنو",
          "نمونه‌های مهم جغرافیایی؛ رتبه‌بندی بر پایه طول اینجا ارائه نمی‌شود"
        ],
        [
          "دریاچه‌های شاخص",
          "گاردا، ماجوره، کومو",
          "بزرگ‌ترین پهنه‌های آب شیرین عمدتاً در شمال"
        ],
        [
          "مخاطرات",
          "زمین‌لرزه، آتشفشان، سیل، رانش زمین، گرما",
          "خطر در سطح منطقه و فصل متفاوت است"
        ]
      ],
      "sources": [
        [
          "Istat؛ مساحت شهرداری‌ها، استان‌ها و مناطق در ۳۱ دسامبر ۲۰۲۱",
          "https://www.istat.it/classificazione/principali-statistiche-geografiche-sui-comuni/"
        ],
        [
          "آژانس محیط زیست اروپا؛ نمایه محیط زیستی ایتالیا، ۲۰۲۵",
          "https://www.eea.europa.eu/en/europe-environment-2025/countries/italy"
        ],
        [
          "Natural Earth؛ داده برداری عمومی و مقیاس نقشه",
          "https://www.naturalearthdata.com/about/terms-of-use/"
        ]
      ]
    },
    {
      "type": "table",
      "id": "land-neighbors",
      "title": "همسایگان زمینی",
      "columns": [
        "کشور",
        "جهت کلی",
        "نوع تماس"
      ],
      "rows": [
        [
          "فرانسه",
          "شمال‌غرب",
          "مرز زمینی آلپی"
        ],
        [
          "سوئیس",
          "شمال",
          "مرز زمینی آلپی"
        ],
        [
          "اتریش",
          "شمال‌شرق",
          "مرز زمینی آلپی"
        ],
        [
          "اسلوونی",
          "شرق/شمال‌شرق",
          "مرز زمینی"
        ],
        [
          "سان‌مارینو",
          "داخل شبه‌جزیره",
          "کشور مستقل محصور در خشکی"
        ],
        [
          "واتیکان",
          "داخل شهر رم",
          "کشور مستقل محصور در خاک ایتالیا"
        ]
      ],
      "sources": [
        [
          "اتحادیه اروپا؛ پروفایل کشور ایتالیا",
          "https://european-union.europa.eu/principles-countries-history/country-profiles/italy_en"
        ],
        [
          "Natural Earth؛ داده برداری عمومی و مقیاس نقشه",
          "https://www.naturalearthdata.com/about/terms-of-use/"
        ]
      ]
    }
  ]
}
