{
  "schema_version": 1,
  "country_code": "ITA",
  "section": "culture",
  "revision": 2,
  "updated_at": "2026-10-27",
  "language": "fa",
  "title": "فرهنگ و زندگی روزمره",
  "intro": "فرهنگ ایتالیا از سنت‌های منطقه‌ای و زبانی متنوع شکل گرفته است؛ تصویر واحدی از غذا، هنر یا آداب همه مناطق را بازنمایی نمی‌کند.",
  "metrics": [],
  "topics": [
    {
      "id": "language-and-traditions",
      "title": "زبان، ادبیات و آیین‌ها",
      "lead": "ایتالیایی زبان رسمی سراسری است و چندین زبان تاریخی محلی بر اساس قوانین و اسناد اروپایی حمایت می‌شوند.",
      "parts": [
        [
          "زبان و گویش",
          "ایتالیایی با خط لاتین نوشته می‌شود. زبان‌های آلمانی، فرانسوی، اسلوونیایی، لادین، ساردی و دیگر زبان‌های اقلیت در برخی مناطق حضور دارند. «گویش»های ایتالیایی نیز از نظر تاریخی طیفی از گونه‌های رومی‌اند؛ آن‌ها را بدون داده یک گروه قومی جداگانه نمی‌شماریم."
        ],
        [
          "ادبیات و هنر",
          "دانته آلیگیری، پترارک و بوکاچو در شکل‌گیری ادبیات ایتالیایی جایگاه مهمی دارند. رنسانس، اپرا، معماری، نقاشی و سینمای ایتالیا میراث فرامنطقه‌ای ساخته‌اند؛ جریان‌های هنری در شهرها و دوره‌های متفاوت پدید آمده‌اند."
        ],
        [
          "ادیان و تعطیلات",
          "کاتولیسیسم از نظر تاریخی دین پرپیرو و نهادی برجسته است، اما سرشماری ایتالیا عضویت دینی را مانند داده جمعیت‌شناختی رسمی ثبت نمی‌کند. جمهوری سکولار است و آزادی دین در قانون تضمین شده است. تعطیلات عمومی شامل ۲۵ آوریل، ۱ مه، ۲ ژوئن و ۱۵ اوت است."
        ]
      ],
      "sources": [
        [
          "قانون اساسی جمهوری ایتالیا؛ متن انگلیسی مجلس سنا",
          "https://www.senato.it/sites/default/files/media-documents/Costituzione_INGLESE.pdf"
        ],
        [
          "اتحادیه اروپا؛ پروفایل کشور ایتالیا",
          "https://european-union.europa.eu/principles-countries-history/country-profiles/italy_en"
        ],
        [
          "یونسکو؛ میراث فرهنگی ناملموس ایتالیا",
          "https://ich.unesco.org/en/state/italy-IT"
        ],
        [
          "روزنامه رسمی جمهوری ایتالیا؛ قانون ۸ اکتبر ۲۰۲۵ شماره ۱۵۱، ایجاد روز ملی سن فرانچسکو",
          "https://www.gazzettaufficiale.it/eli/id/2025/10/10/25G00153/sg"
        ]
      ]
    },
    {
      "id": "food-design-heritage",
      "title": "خوراک، هنر و میراث",
      "lead": "غذا و هنر ایتالیا تنوع منطقه‌ای دارند و عنوان‌های جهانی نباید جای روایت محلی را بگیرند.",
      "parts": [
        [
          "خوراک منطقه‌ای",
          "پاستا، پیتزا، ریزوتو، پولنتا، پنیرها و روغن زیتون نمونه‌های شناخته‌شده‌اند؛ دستورها و نام‌ها میان شهرها و مناطق تفاوت دارند. قهوه‌بار و وعده‌های جمعی در بسیاری از محیط‌ها بخش مهم زندگی اجتماعی‌اند."
        ],
        [
          "میراث ناملموس و جهانی",
          "یونسکو میراث جهانی و عناصر ناملموس متعدد مرتبط با ایتالیا را ثبت کرده است، از جمله هنر ساخت پیتزای ناپلی و اپراخوانی. یونسکو در صفحه کشور ۶۲ ملک جهانی را ثبت کرده است؛ شمار ثبت‌ها ممکن است تغییر کند."
        ],
        [
          "آداب و پوشاک",
          "آداب معاشرت، زمان غذا و شیوه پوشش به موقعیت اجتماعی و منطقه وابسته است. پوشاک مد و طراحی ایتالیایی صنعت فرهنگی مهمی است؛ کلیشه‌های ملی جای توصیف تفاوت‌های شهری و نسلی را نمی‌گیرند."
        ]
      ],
      "sources": [
        [
          "یونسکو؛ پروفایل ایتالیا و میراث جهانی",
          "https://whc.unesco.org/en/statesparties/it"
        ],
        [
          "یونسکو؛ میراث فرهنگی ناملموس ایتالیا",
          "https://ich.unesco.org/en/state/italy-IT"
        ],
        [
          "وبگاه رسمی گردشگری ایتالیا؛ Italia.it",
          "https://www.italia.it/en"
        ]
      ]
    },
    {
      "id": "culture-regional-cultures",
      "title": "هویت‌های منطقه‌ای، آیین‌ها و خوراک",
      "lead": "فرهنگ ایتالیا مجموعه‌ای از سنت‌های محلی و ملی است؛ نام غذا یا جشن واحد، تفاوت‌های منطقه‌ای را حذف نمی‌کند.",
      "parts": [
        [
          "آیین‌ها",
          "کارناوال ونیز، پاليوی سیه‌نا و جشن سن جنارو ناپل از رویدادهای محلی شناخته‌شده‌اند؛ زمان و قواعدشان باید با برگزارکننده همان سال کنترل شود."
        ],
        [
          "خوراک",
          "پاستا، پیتزا، ریزوتو، پولنتا، پنیر و روغن زیتون در منطقه‌ها ترکیب و دستورهای متفاوت دارند؛ عنوان «غذای ملی» همیشه ساده‌سازی است."
        ],
        [
          "سبک زندگی",
          "زمان غذا، پوشاک و آداب معاشرت به نسل، شهر و موقعیت وابسته است. پوشاک و طراحی معاصر کنار میراث تاریخی بخش مهمی از صنایع فرهنگی‌اند."
        ]
      ],
      "sources": [
        [
          "یونسکو؛ میراث ناملموس ایتالیا",
          "https://ich.unesco.org/en/state/italy-IT?info=elements-on-the-lists"
        ],
        [
          "وبگاه رسمی گردشگری ایتالیا",
          "https://www.italia.it/en"
        ]
      ]
    },
    {
      "id": "culture-world-and-living-heritage",
      "title": "میراث جهانی و سنت‌های زنده",
      "lead": "ثبت یونسکو میراث مکانی را از میراث ناملموس جدا می‌کند و شمار ثبت‌ها با تصمیم‌های تازه تغییر می‌کند.",
      "parts": [
        [
          "میراث جهانی",
          "صفحه یونسکو برای ایتالیا ۶۲ ملک نشان می‌دهد: ۵۶ فرهنگی و ۶ طبیعی. برخی ملک‌ها چندشهره یا فرامرزی‌اند."
        ],
        [
          "میراث ناملموس",
          "یونسکو ۲۱ عنصر مرتبط با ایتالیا ثبت کرده؛ از آشپزی ایتالیایی (۲۰۲۵) تا آواز اپرا، زنگ‌نوازی دستی و هنر عروسکی سیسیلی."
        ],
        [
          "تفسیر",
          "این فهرست‌ها به معنی پوشش همه میراث محلی یا سهم برابر همه مناطق نیستند و باید با تاریخ مراجعه به‌روز شوند."
        ]
      ],
      "sources": [
        [
          "یونسکو؛ فهرست میراث جهانی ایتالیا",
          "https://whc.unesco.org/en/statesparties/it/"
        ],
        [
          "یونسکو؛ میراث ناملموس ایتالیا",
          "https://ich.unesco.org/en/state/italy-IT?info=elements-on-the-lists"
        ]
      ]
    }
  ],
  "facts": [],
  "neighbors": [],
  "map_points": [],
  "key_tables": [
    {
      "type": "table",
      "id": "cultural-forms",
      "title": "صورت‌های فرهنگی شاخص",
      "columns": [
        "حوزه",
        "نمونه و توضیح"
      ],
      "rows": [
        [
          "زبان",
          "ایتالیایی رسمی؛ زبان‌های اقلیت منطقه‌ای با حمایت قانونی"
        ],
        [
          "ادبیات",
          "دانته، پترارک و بوکاچو؛ سنت‌های ادبی چنددوره‌ای"
        ],
        [
          "هنرهای نمایشی",
          "اپرا و تئاتر؛ مراکز تاریخی در چندین شهر"
        ],
        [
          "خوراک",
          "غذاهای منطقه‌ای؛ پاستا، پیتزا، پنیر و روغن زیتون"
        ],
        [
          "میراث ناملموس",
          "فهرست زنده یونسکو؛ عناصر ثبت‌شده و تاریخ ثبت در صفحه مرجع"
        ],
        [
          "تعطیلات ملی",
          "۲۵ آوریل، ۱ مه، ۲ ژوئن، ۱۵ اوت؛ از ۲۰۲۶، ۴ اکتبر نیز تعطیل ملی است"
        ]
      ],
      "sources": [
        [
          "قانون اساسی جمهوری ایتالیا؛ متن انگلیسی مجلس سنا",
          "https://www.senato.it/sites/default/files/media-documents/Costituzione_INGLESE.pdf"
        ],
        [
          "یونسکو؛ پروفایل ایتالیا و میراث جهانی",
          "https://whc.unesco.org/en/statesparties/it"
        ],
        [
          "یونسکو؛ میراث فرهنگی ناملموس ایتالیا",
          "https://ich.unesco.org/en/state/italy-IT"
        ],
        [
          "روزنامه رسمی؛ قانون ۱۵۱/۲۰۲۵",
          "https://www.gazzettaufficiale.it/eli/id/2025/10/10/25G00153/sg"
        ]
      ]
    },
    {
      "type": "table",
      "id": "unesco-count",
      "title": "میراث ثبت‌شده",
      "columns": [
        "نوع",
        "وضعیت"
      ],
      "rows": [
        [
          "میراث جهانی",
          "پایگاه یونسکو ایتالیا؛ شمار جاری در این فایل ثابت نشده و باید از صفحه زنده خوانده شود"
        ],
        [
          "میراث ناملموس",
          "پایگاه یونسکو؛ عناصر و سال ثبت جداگانه فهرست می‌شوند"
        ]
      ],
      "sources": [
        [
          "یونسکو؛ پروفایل ایتالیا و میراث جهانی",
          "https://whc.unesco.org/en/statesparties/it"
        ],
        [
          "یونسکو؛ میراث فرهنگی ناملموس ایتالیا",
          "https://ich.unesco.org/en/state/italy-IT"
        ]
      ],
      "note": "از ثبت تعداد ثابت پرهیز شده چون فهرست یونسکو در طول زمان تغییر می‌کند."
    },
    {
      "type": "table",
      "id": "unesco-counts-current",
      "title": "ثبت‌های یونسکو؛ صفحه کشور",
      "columns": [
        "نوع فهرست",
        "تعداد",
        "تفکیک"
      ],
      "rows": [
        [
          "میراث جهانی",
          "۶۲",
          "۵۶ فرهنگی، ۶ طبیعی"
        ],
        [
          "میراث ناملموس",
          "۲۱",
          "عناصر و برنامه‌های کشور"
        ]
      ],
      "sources": [
        [
          "یونسکو؛ میراث جهانی ایتالیا",
          "https://whc.unesco.org/en/statesparties/it/"
        ],
        [
          "یونسکو؛ میراث ناملموس ایتالیا",
          "https://ich.unesco.org/en/state/italy-IT?info=elements-on-the-lists"
        ]
      ],
      "note": "شمار ثبت‌ها با افزودن پرونده‌های جدید تغییر می‌کند."
    }
  ]
}
