{
  "schema_version": 1,
  "country_code": "ITA",
  "section": "politics",
  "revision": 2,
  "updated_at": "2026-10-27",
  "language": "fa",
  "title": "حکومت و سیاست ایتالیا",
  "intro": "جمهوری ایتالیا بر اساس قانون اساسی ۱۹۴۸ اداره می‌شود؛ رئیس‌جمهور رئیس کشور و نخست‌وزیر رئیس دولت است. این بخش وضعیت نهادها را از مقام‌های روز تفکیک می‌کند.",
  "metrics": [],
  "topics": [
    {
      "id": "constitutional-framework",
      "title": "قانون اساسی و نهادهای جمهوری",
      "lead": "قانون اساسی پس از همه‌پرسی جمهوری و پایان سلطنت تدوین و از ۱ ژانویه ۱۹۴۸ لازم‌الاجرا شد.",
      "parts": [
        [
          "قوه اجرایی",
          "رئیس‌جمهور را دو مجلس پارلمان در نشست مشترک، همراه نمایندگان مناطق، برای دوره هفت‌ساله انتخاب می‌کنند. رئیس‌جمهور نخست‌وزیر را منصوب می‌کند؛ دولت برای آغاز و ادامه کار به اعتماد هر دو مجلس نیاز دارد."
        ],
        [
          "قوه مقننه",
          "پارلمان دو مجلسی است: مجلس نمایندگان و سنا. قانون‌گذاری عادی بر پایه متن مصوب هر دو مجلس انجام می‌شود؛ تعداد کرسی‌ها پس از اصلاح قانون اساسی کاهش یافته است."
        ],
        [
          "قوه قضاییه",
          "قضات مستقل‌اند. دادگاه قانون اساسی بر انطباق قوانین با قانون اساسی نظارت دارد و اعضای آن از سوی رئیس‌جمهور، پارلمان و عالی‌ترین مراجع قضایی منصوب/برگزیده می‌شوند."
        ]
      ],
      "sources": [
        [
          "قانون اساسی جمهوری ایتالیا؛ متن انگلیسی مجلس سنا",
          "https://www.senato.it/sites/default/files/media-documents/Costituzione_INGLESE.pdf"
        ]
      ]
    },
    {
      "id": "government-current",
      "title": "دولت و رقابت سیاسی؛ وضعیت بررسی‌شده",
      "lead": "مقام‌های اجرایی متغیرند؛ این یادداشت فقط در تاریخ ۲۷ اکتبر ۲۰۲۶ بررسی شده است.",
      "parts": [
        [
          "مقام‌های کنونی",
          "وبگاه رسمی دولت تا تاریخ بررسی جورجا ملونی را رئیس شورای وزیران ثبت می‌کند. سرجو ماتارلا رئیس‌جمهور جمهوری است. انتساب و تاریخ تصدی باید پیش از هر انتشار بعدی دوباره کنترل شود."
        ],
        [
          "انتخابات و احزاب",
          "انتخابات سراسری برای دو مجلس، بر پایه نظام انتخاباتی ترکیبی با کرسی‌های حوزه‌ای و تناسبی برگزار می‌شود. ائتلاف‌ها و احزاب در طول زمان تغییر می‌کنند؛ در این نسخه فهرست «احزاب اصلی» به‌عنوان رتبه‌بندی روزانه درج نشده است."
        ],
        [
          "سیاست خارجی",
          "ایتالیا عضو اتحادیه اروپا، منطقه یورو، ناتو، سازمان ملل، گروه G7 و G20 است. سیاست مشترک اتحادیه اروپا، روابط مدیترانه‌ای و پیوندهای فراآتلانتیکی از چارچوب‌های مهم سیاست خارجی‌اند."
        ]
      ],
      "sources": [
        [
          "ریاست‌جمهوری ایتالیا؛ رئیس‌جمهور و نمادهای ملی",
          "https://www.quirinale.it/it/pagine/english"
        ],
        [
          "اتحادیه اروپا؛ پروفایل کشور ایتالیا",
          "https://european-union.europa.eu/principles-countries-history/country-profiles/italy_en"
        ],
        [
          "دولت ایتالیا؛ رئیس شورای وزیران و آغاز دوره تصدی",
          "https://governo.it/il-presidente"
        ]
      ]
    },
    {
      "id": "politics-elections",
      "title": "انتخابات، پارلمان و رقابت حزبی",
      "lead": "نظام پارلمانی به اعتماد هر دو مجلس وابسته است؛ نتایج و ائتلاف‌ها باید همراه تاریخ انتخابات خوانده شوند.",
      "parts": [
        [
          "پارلمان",
          "پارلمان دو مجلسی از مجلس نمایندگان و سنا تشکیل می‌شود. قانون‌گذاری عادی در هر دو مجلس بررسی می‌شود."
        ],
        [
          "انتخاب رئیس‌جمهور",
          "رئیس‌جمهور را پارلمان در نشست مشترک با نمایندگان مناطق برای دوره هفت‌ساله انتخاب می‌کند؛ انتخاب مستقیم عمومی نیست."
        ],
        [
          "احزاب",
          "رقابت چندحزبی و ائتلاف‌ها در تشکیل دولت اثر دارند. عنوان «احزاب اصلی» ثابت نیست و باید با نتایج آخرین انتخابات و دوره زمانی ثبت شود."
        ]
      ],
      "sources": [
        [
          "قانون اساسی ایتالیا؛ مجلس سنا",
          "https://www.senato.it/sites/default/files/media-documents/Costituzione_INGLESE.pdf"
        ],
        [
          "مجلس نمایندگان ایتالیا",
          "https://www.camera.it/leg19/1"
        ]
      ]
    }
  ],
  "facts": [],
  "neighbors": [],
  "map_points": [],
  "key_tables": [
    {
      "type": "table",
      "id": "institutions",
      "title": "نهادهای اصلی",
      "columns": [
        "نهاد",
        "شیوه شکل‌گیری/نقش"
      ],
      "rows": [
        [
          "رئیس‌جمهور",
          "انتخاب غیرمستقیم برای ۷ سال؛ رئیس کشور"
        ],
        [
          "دولت",
          "نخست‌وزیر منصوب رئیس‌جمهور؛ نیازمند رأی اعتماد دو مجلس"
        ],
        [
          "مجلس نمایندگان",
          "مجلس منتخب ملی؛ قانون‌گذاری و نظارت"
        ],
        [
          "سنا",
          "مجلس دوم؛ قانون‌گذاری و اعتماد به دولت"
        ],
        [
          "دادگاه قانون اساسی",
          "نظارت بر قانون اساسی؛ ترکیب انتصابی/انتخابی طبق قانون اساسی"
        ],
        [
          "دادگاه‌ها",
          "مستقل؛ نظام قضایی و دادستانی تابع قانون اساسی"
        ]
      ],
      "sources": [
        [
          "قانون اساسی جمهوری ایتالیا؛ متن انگلیسی مجلس سنا",
          "https://www.senato.it/sites/default/files/media-documents/Costituzione_INGLESE.pdf"
        ]
      ]
    },
    {
      "type": "table",
      "id": "officeholders",
      "title": "مقام‌های بررسی‌شده",
      "columns": [
        "سمت",
        "نام",
        "مبنای بررسی"
      ],
      "rows": [
        [
          "رئیس‌جمهور",
          "سرجو ماتارلا",
          "وبگاه ریاست‌جمهوری؛ بررسی ۲۷ اکتبر ۲۰۲۶"
        ],
        [
          "رئیس شورای وزیران",
          "جورجا ملونی",
          "وبگاه دولت؛ بررسی ۲۷ اکتبر ۲۰۲۶"
        ]
      ],
      "sources": [
        [
          "ریاست‌جمهوری ایتالیا؛ رئیس‌جمهور و نمادهای ملی",
          "https://www.quirinale.it/it/pagine/english"
        ],
        [
          "دولت ایتالیا؛ رئیس شورای وزیران",
          "https://www.governo.it/en/government"
        ]
      ],
      "note": "اسامی مقام‌های فعلی داده متغیر است؛ قبل از استفاده در انتشار بعدی بازبینی شود."
    }
  ]
}
